title,url,topic,format,audience_segment,word_count,publish_date,views,engagement_rate,avg_time_on_page,conversions,search_rank
Show HN: Qwen3.6-35B-A3B on a 16 GB M1 Pro with SSD-streamed MoE,https://github.com/andreaborio/ds4,Security,case_study,developers,336,2026-07-18,505,0.07142857142857142,37.37019660084432,3,
Launch HN: Traceforce (YC S26) – Company-wide security monitoring for AI apps,https://news.ycombinator.com/item?id=48937020,AI/ML,blog,developers,264,2026-07-16,1511,0.35,13.69435812048302,6,
Reynard: A real Firefox web browser for iOS 13 or later,https://github.com/minh-ton/reynard-browser,Frontend,case_study,developers,275,2026-07-16,4102,0.3273809523809524,474.4044876140577,11,
Old Icons,https://leancrew.com/all-this/2026/07/old-icons/,Data Engineering,blog,general_tech,100,2026-07-12,3802,0.30612244897959184,106.19464404400871,28,
Ring-Zero: Scaling Zero RL to a Trillion Parameters for Emergent Reasoning,https://arxiv.org/abs/2607.12395,Mobile,whitepaper,developers,209,2026-07-17,1163,0.35,116.69316225234793,2,
Show HN: Simulator for a custom 8-bit discreet logic computer,https://msap2.mehran.dk,Platform,blog,executives,220,2026-07-14,881,0.2,39.00304665680595,5,
In Praise of Exhaustive Destructuring,https://antoine.vandecreme.net/blog/exhaustive-destructuring-praise/,AI/ML,blog,developers,110,2026-07-12,1317,0.14285714285714285,143.4283824566712,6,
Immersive Linear Algebra Book with Interactive Figures (2015),https://immersivemath.com/ila/,Leadership,blog,managers,176,2026-07-16,8446,0.10416666666666667,303.443266758535,31,
Jurassic Park computers in excruciating detail,https://fabiensanglard.net/jurrasic_park_computers/index.html,AI/ML,blog,developers,162,2026-07-15,19585,0.2655426765015806,2204.2218066759956,61,
Abstracting Effects with Continuations,https://crowdhailer.me/2026-07-15/abstracting-effects-with-continuations/,DevOps,blog,developers,100,2026-07-16,1102,0.08333333333333333,55.02747287790366,8,
I also filed the corners off my MacBook,https://www.brt.fyi/posts/mac-book-filing/,Cloud,blog,developers,200,2026-07-15,12056,0.35,842.1361136525898,48,
Show HN: Leaves – A text-UI disk usage treemap visualizer,https://github.com/patonw/leaves,Frontend,case_study,general_tech,210,2026-07-16,3038,0.32222222222222224,94.4785127812229,6,
Agent Security Is a Systems Problem,https://arxiv.org/abs/2605.18991,Security,whitepaper,developers,168,2026-07-18,311,0.1,17.903312541277735,0,
We're Building Postgres in Rust. Using the LLVM of Databases,https://turso.tech/blog/a-new-modern-version-of-postgres-in-rust,Data Engineering,blog,developers,200,2026-07-16,2919,0.23809523809523808,269.43226646664516,18,
"London Underground users should know about toxic dust risk, whistleblower says",https://www.theguardian.com/uk-news/2026/jul/18/london-underground-passengers-should-know-about-toxic-dust-risks-whistleblower-says,Backend,blog,executives,242,2026-07-18,344,0.35,15.38166672728708,1,
Collection of Digital Clock Designs,https://clocks.dev,Mobile,blog,developers,115,2026-07-15,7606,0.16666666666666666,278.68325418038455,54,
Martin Picard's Mitochondrial Theory of Mind,https://www.quantamagazine.org/martin-picards-mitochondrial-theory-of-mind-20260717/,Platform,blog,developers,132,2026-07-18,229,0.1111111111111111,12.825241892511057,0,
The kids with phones are alright,https://heatherburns.tech/2026/07/08/the-kids-with-phones-are-alright/,Leadership,blog,managers,168,2026-07-11,10608,0.35,484.8394206017664,60,
Guide to data tools landscape for developers,https://sinja.io/blog/data-landscape-guide-for-developers,Data Engineering,blog,developers,133,2026-07-16,2351,0.27906976744186046,122.51511000370633,11,
Job queues are deceptively tricky,https://typesanitizer.com/blog/job-queues.html,DevOps,blog,executives,100,2026-07-14,3138,0.3404255319148936,80.2613016898004,7,
The privacy problems hidden in your period tracker,https://www.bbc.com/future/article/20260715-how-period-trackers-share-womens-private-details,Security,blog,general_tech,208,2026-07-17,3472,0.35,269.6368794148626,10,
Making 768 servers look like 1,https://planetscale.com/blog/making-768-servers-look-like-1,Cloud,blog,developers,120,2026-07-16,3940,0.35,268.88012340740653,24,
Detecting LLM-Generated Texts with “Classical” Machine Learning,https://blog.lyc8503.net/en/post/llm-classifier/,AI/ML,blog,developers,161,2026-07-16,3809,0.35,400.0694527832973,5,
Stripe and Advent have made a joint offer to acquire PayPal – sources,https://www.reuters.com/business/finance/stripe-advent-offer-buy-paypal-more-than-53-billion-sources-say-2026-07-15/,Frontend,blog,developers,325,2026-07-15,7853,0.35,522.2128306077466,45,
The Little Book of Reinforcement Learning,https://github.com/alxndrTL/little-book-rl/,Backend,case_study,developers,138,2026-07-17,3810,0.125,536.7632974979767,29,
Pushinka,https://en.wikipedia.org/wiki/Pushinka,Mobile,blog,developers,100,2026-07-17,1638,0.3,38.23051236817282,9,
Show HN: Mojibake – A low-level Unicode library written in C,https://mojibake.zaerl.com/,Platform,blog,general_tech,231,2026-07-17,2301,0.29333333333333333,224.21938730761042,11,
Pre-Authentication RCE in WordPress Core,https://wp2shell.com/,Leadership,blog,managers,100,2026-07-18,731,0.2,33.00576627644724,5,
Sleep regularity is a stronger predictor of mortality risk than sleep duration (2023),https://academic.oup.com/sleep/article/47/1/zsad253/7280269,DevOps,blog,executives,351,2026-07-15,25418,0.35,363.938270376162,142,
Open Source Parametric DIY Air Purifier Builder,https://www.filterboxbuilder.com/,AI/ML,blog,developers,140,2026-07-18,219,0.07692307692307693,16.794721513087772,0,
Launch HN: Coasty (YC S26) – An API for computer-use agents,https://coasty.ai/docs,Backend,blog,developers,264,2026-07-15,1547,0.35,118.77113996426327,8,
"Today I Rescued 7,234 Old GIFs",https://danq.me/2026/07/10/rescuing-7234-gifs/,Cloud,blog,executives,168,2026-07-13,2538,0.16216216216216217,135.75222597126705,2,
Towards a harness that can do anything,https://eardatasci.github.io/c/ambiance/index.html,Security,blog,general_tech,154,2026-07-15,5957,0.35,562.0873330969575,34,
Grok Build is open source,https://github.com/xai-org/grok-build,Frontend,case_study,developers,125,2026-07-16,10640,0.35,1311.1473605900483,39,
"Duskers, the scary command line game, is getting a sequel",https://elbowgreasegames.substack.com/p/misfits-attic-announces-duskers-20,Data Engineering,newsletter,general_tech,220,2026-07-16,2646,0.28289473684210525,306.6252860896249,19,
Big Tech's top executives warn enterprises are giving away too much to AI labs,https://fortune.com/2026/07/16/microsoft-ceo-satya-nadella-warns-enterprises-that-ai-labs-are-stealing-their-know-how/,AI/ML,blog,developers,378,2026-07-18,80,0.0,2.8836829124004715,0,
"Governments, companies, nonprofits should invest in free, open source AI [pdf]",https://www.siegelendowment.org/wp-content/uploads/2026/07/fortune-david-siegel-open-source-ai.pdf,AI/ML,blog,executives,209,2026-07-16,8150,0.35,665.1763239696921,10,
A Beautiful Theory Falls to Ugly Data,https://marginalrevolution.com/marginalrevolution/2026/05/a-beautiful-theory-falls-to-ugly-data.html,Data Engineering,blog,developers,161,2026-07-13,2703,0.35,183.55558417152997,17,
Scaling to 1M concurrent sandboxes in seconds,https://modal.com/blog/scaling-to-1-million-concurrent-sandboxes-in-seconds,Mobile,blog,developers,182,2026-07-17,1328,0.2,68.8568356763023,8,
CVE-2026-25089: FortiSandbox unauthenticated command injection added to CISA KEV,https://hellorecon.com/blog/cve-2026-25089,Platform,blog,developers,216,2026-07-17,602,0.030303030303030304,43.24690245001509,3,
Britain's Nearly Revolution of 1926,https://davidaaronovitch.substack.com/p/britains-nearly-revolution,AI/ML,newsletter,developers,100,2026-07-18,46,0.0,3.6453486774859236,0,
Australian energy retailers must offer three hours of free daytime electricity,https://lenergy.com.au/free-daytime-electricity-is-coming-heres-how-it-actually-works/,AI/ML,blog,developers,275,2026-07-14,9805,0.35,427.5781611001894,46,
Ask HN: What Are You Working On? (July 2026),https://news.ycombinator.com/item?id=48884984,Leadership,blog,managers,162,2026-07-13,5971,0.35,376.23160881481806,44,
UIUC AI Teaching Assistant,https://github.com/Center-for-AI-Innovation/ai-teaching-assistant-uiuc,AI/ML,case_study,developers,112,2026-07-17,668,0.11538461538461539,66.77136174246105,1,
Briar is in maintenance mode,https://briarproject.org/news/2026-maintenance-mode/,AI/ML,blog,general_tech,110,2026-07-15,3941,0.35,372.64548228005157,22,
Microsoft has released software updates to plug at least 570 security holes,https://krebsonsecurity.com/2026/07/microsoft-patches-a-record-570-security-flaws/,Security,blog,developers,264,2026-07-15,4345,0.35,216.22019095213992,29,
Show HN: Firefox in WebAssembly,https://developer.puter.com/labs/firefox-wasm/,Frontend,blog,developers,105,2026-07-16,9082,0.35,695.8777992159426,26,
"G# – A modern .NET language with Go, Kotlin, and Swift ergonomics",https://davidobando.github.io/gsharp/,Backend,blog,developers,216,2026-07-11,2204,0.35,273.9078802285829,6,
Telegram Serverless,https://core.telegram.org/bots/serverless,Cloud,blog,developers,100,2026-07-15,4125,0.35,295.7742814205281,10,
Timeline Scan – AI fixes the dates on your scanned photos,https://timelinescan.com/,AI/ML,blog,developers,308,2026-07-17,1121,0.35,30.7455738885014,7,
Nadella Blasts AI Industry's Double Standard,https://finance.biggo.com/news/438f299b-ca23-468d-b37d-0ffe09a4ca55,AI/ML,blog,developers,120,2026-07-18,813,0.27586206896551724,53.62418896191999,4,
"My midlife crisis Corolla is fast, furious, and modded",https://www.zocalopublicsquare.org/my-midlife-crisis-corolla-fast-furious-fully-modded/,DevOps,blog,developers,180,2026-07-15,3959,0.35,465.5409795811655,12,
Voxatron,https://www.lexaloffle.com/voxatron.php,Mobile,blog,developers,100,2026-07-16,3346,0.25,91.96939787897982,17,
Your 'app' could have been a webpage (so I fixed it for you),https://danq.me/2026/07/09/your-app-could-have-been-a-webpage/,Frontend,blog,developers,247,2026-07-11,29944,0.35,2193.280739040053,152,
I tried to record music onto a cassette tape using modern tech,https://swiftrocks.com/i-tried-to-record-music-onto-a-cassette-tape-using-modern-tech,Platform,blog,developers,216,2026-07-17,209,0.35,16.58071317445391,1,
"1,300 Beautiful Wildlife Illustrations from the 19th Century Now Restored",https://www.openculture.com/2026/07/explore-1300-beautiful-wildlife-illustrations-from-the-19th-century.html,Backend,blog,executives,210,2026-07-16,6589,0.1984126984126984,261.8334036132457,33,
Agent-talk: Enabling coding agents to work together,https://github.com/xhluca/agent-talk,Leadership,case_study,managers,182,2026-07-16,1707,0.35,123.686172469653,11,
Show HN: misa77 - a codec that decodes 2x faster than LZ4 (at better ratios),https://github.com/welcome-to-the-sunny-side/misa77,Mobile,case_study,developers,330,2026-07-15,3740,0.2926829268292683,90.45215785356835,26,
Lingbot-map: A 3D foundation model for reconstructing scenes from streaming data,https://github.com/Robbyant/lingbot-map,Data Engineering,case_study,executives,242,2026-07-17,704,0.038461538461538464,47.095839018939515,4,
LLM Networking with MikroTik,https://blog.greg.technology/2026/07/14/llm-networking-with-mikrotik.html,AI/ML,blog,general_tech,104,2026-07-16,3842,0.35,44.781476203266486,7,
The Conservationist Who Turned 40 Terabytes of Public Data into a Video Game,https://blog.exe.dev/meet-the-conservationist-who-turned-40-terabytes-of-government-data-into-a-video-game,Data Engineering,video,developers,312,2026-07-14,3702,0.17355371900826447,252.15076111910832,13,
America Broke Its Own Military,https://tribunemag.co.uk/2026/07/how-america-broke-its-own-military,DevOps,blog,executives,140,2026-07-18,366,0.0,12.917156353987371,0,
Solod: Go can be a better C,https://solod.dev,Backend,blog,developers,140,2026-07-13,6371,0.35,179.89526795235832,16,
Bonsai 27B: A 27B-Class model that runs on a phone,https://prismml.com/news/bonsai-27b,AI/ML,blog,developers,250,2026-07-14,26547,0.35,663.2609493716719,165,
