title,url,topic,format,audience_segment,word_count,publish_date,views,engagement_rate,avg_time_on_page,conversions,search_rank
"Goodbye, and Thanks for All the Bikesheds",https://queue.acm.org/detail.cfm?id=3818307,Backend,blog,developers,140,2026-07-18,1360,0.23255813953488372,78.47844434416963,5,
GPT-5.6 used a prompt to close a 30-year gap in convex optimization,https://old.reddit.com/r/math/comments/1uxj3cy/after_openais_cdc_proof_announcement_gpt56_used_a/,AI/ML,blog,developers,240,2026-07-18,9907,0.35,614.5761956853108,53,
Gleam Is Now on Tangled,https://tangled.org/gleam.run/gleam,DevOps,blog,developers,105,2026-07-18,1624,0.35,275.2225487040569,9,
"Setting up your spare Mac for Claude Code to control, a step-by-step guide",https://ykdojo.github.io/claude-controls-mac/,Frontend,blog,developers,247,2026-07-18,2532,0.35,120.78806649027794,7,
Our Approach to Bioresilience: Isomorphic Labs and Google DeepMind,https://deepmind.google/blog/our-approach-to-bioresilience/,Backend,blog,executives,207,2026-07-18,743,0.35,11.196721609200672,0,
"If You Build It, They Will Come",https://www.benlandautaylor.com/p/if-you-build-it-they-will-come,Frontend,blog,developers,154,2026-07-18,2322,0.3389830508474576,74.89270072190335,13,
Elixir-lang.org has a new design,https://elixir-lang.org/,Cloud,blog,developers,100,2026-07-18,1271,0.35,96.96061373365532,3,
Is this the end of the once-mighty GoPro?,https://amateurphotographer.com/latest/photo-news/going-going-gone-is-this-the-end-of-the-once-mighty-gopro/,Backend,blog,developers,224,2026-07-15,3385,0.35,49.050331058150825,8,
Fable 5 vs. GPT-5.6 Sol on an NP-Hard Problem: Does /goal help?,https://charlesazam.com/blog/fable-5-gpt-5-6-sol-goal/,AI/ML,blog,developers,252,2026-07-18,3942,0.35,90.64487622775431,19,
Show HN: Q3Edit – Edit and play Quake 3 maps in the browser,https://q3edit.com,Security,blog,developers,325,2026-07-18,784,0.20689655172413793,72.89496335983272,0,
LG monitors silently install software through Windows Update without consent,https://videocardz.com/newz/lg-monitors-silently-install-software-through-windows-update-without-user-consent,Data Engineering,blog,developers,180,2026-07-18,14051,0.35,480.4931036950717,87,
Show HN: Get alerts for good seats at 70mm IMAX showings of The Odyssey,https://imaxxing.io/,Backend,blog,developers,336,2026-07-18,79,0.35,1.9864008796806911,0,
Regressive JPEGs,https://maurycyz.com/projects/bad_jpeg/,Mobile,blog,developers,100,2026-07-18,17340,0.10260869565217391,1093.2152722170003,130,
Tech note: making your own V-I plots at home,https://lcamtuf.substack.com/p/tech-note-making-your-own-v-i-plots,Platform,newsletter,developers,198,2026-07-18,1191,0.15384615384615385,93.88951113247518,5,
A Second-Grade Teacher Revived a Beloved Video Game,https://www.nytimes.com/2026/07/13/style/backyard-baseball-video-game-teacher.html,Leadership,video,managers,208,2026-07-13,772,0.2727272727272727,50.62729127916898,3,
What AI did to stackoverflow in a graph,https://data.stackexchange.com/stackoverflow/query/1953768#graph,AI/ML,blog,developers,168,2026-07-18,7044,0.35,556.2542537460946,35,
How GitHub gave every repository a durable owner,https://github.blog/security/application-security/how-github-gave-every-repository-a-durable-owner/,DevOps,blog,developers,192,2026-07-10,904,0.16129032258064516,55.91414605431553,3,
GTX 1080s: Testing a Legend,https://www.lttlabs.com/articles/2026/07/15/gtx-1080s-revisiting-legends,Cloud,blog,general_tech,115,2026-07-16,858,0.3333333333333333,46.42152278398828,3,
EU ban on destruction of unsold clothes and shoes enters into application,https://environment.ec.europa.eu/news/ban-destruction-unsold-clothes-and-shoes-enters-application-2026-07-17_en,Mobile,blog,developers,240,2026-07-18,5627,0.35,69.76498433127381,24,
Reviving a 15-year-old netbook with Arch Linux,https://parksb.github.io/en/article/41.html,Security,blog,developers,189,2026-07-14,3629,0.35,466.81698679998937,7,
Thanks HN for 15 years of support and helping me find my life's work,https://news.ycombinator.com/item?id=48949551,Data Engineering,blog,developers,280,2026-07-17,25692,0.1273209549071618,1471.1726407782,98,
The Computer at the Bottom of a Canal,https://negroniventurestudios.com/2026/07/18/the-computer-at-the-bottom-of-a-canal/,Platform,blog,developers,184,2026-07-18,3530,0.21621621621621623,105.59511860444962,10,
"The Fermi Paradox, Percolation, and Inbreeding",https://reactormag.com/the-fermi-paradox-percolation-and-inbreeding/,Leadership,blog,managers,120,2026-07-18,279,0.35,9.050779077354623,1,
Fake food delivery site for the dopamine,https://old.reddit.com/r/BingeEatingDisorder/comments/1uzr3ui/fake_food_delivery_site_for_the_dopamine/,DevOps,blog,developers,175,2026-07-18,740,0.3333333333333333,90.69421461460249,4,
First atmosphere found on Earth-like planet in habitable zone of distant star,https://www.bbc.com/news/articles/cy4kdd1e0ejo,Cloud,blog,developers,288,2026-07-17,9151,0.35,1112.9437693460904,30,
British runner Josh Kerr breaks world record for mile which stood for 27 years,https://news.sky.com/story/british-runner-josh-kerr-breaks-world-record-for-mile-which-had-stood-for-27-years-13564688,Security,blog,developers,392,2026-07-18,1839,0.35,69.23794321683187,9,
Qubes OS Security in the Public Record,https://arxiv.org/abs/2607.14587,Security,whitepaper,developers,133,2026-07-18,1313,0.16363636363636364,45.17662741678131,3,
The Zilog Z80 has turned 50,https://goliath32.com/blog/z80.html,Data Engineering,blog,developers,138,2026-07-18,6056,0.35,304.145980754608,32,
No link between acetaminophen use during pregnancy and adverse birth outcomes,https://sph.unc.edu/sph-news/no-link-between-acetaminophen-use-during-pregnancy-and-adverse-birth-outcomes-study-finds/,Frontend,blog,executives,264,2026-07-18,455,0.3333333333333333,72.17093809118899,3,
TP-Link Kasa cameras leaked home GPS via unauthenticated UDP for 6 years,https://github.com/BadChemical/IoT-Vulnerability-Research-Public/blob/main/TP-Link_Kasa_EC71/Kasa_EC71.md,Mobile,case_study,developers,300,2026-07-18,3727,0.35,285.9201961701041,18,
Learning a few things about running SQLite,https://jvns.ca/blog/2026/07/17/learning-about-running-sqlite/,Data Engineering,blog,developers,161,2026-07-17,6488,0.2532467532467532,588.7613643077252,17,
"Kimi K3, and what we can still learn from the pelican benchmark",https://simonwillison.net/2026/Jul/16/kimi-k3/,Platform,blog,developers,324,2026-07-17,9550,0.35,339.5747301442426,30,
"Waldi: A quiet place to write, and to be read",https://github.com/waaldev/waldi,Frontend,case_study,developers,190,2026-07-12,1169,0.35,136.67092764744345,7,
AWS: Inaccurate Estimated Billing Data – $1.7 billion,https://news.ycombinator.com/item?id=48945241,Cloud,blog,developers,152,2026-07-17,23630,0.35,832.2091285429487,35,
In-toto: A framework to secure the integrity of software supply chains,https://in-toto.io/,AI/ML,blog,developers,286,2026-07-17,1308,0.21818181818181817,33.48856691589466,3,
DrDroid (YC W23) Is Hiring,https://www.ycombinator.com/companies/drdroid/jobs/w45QcNV-product-engineer-assignment-mandatory,Leadership,blog,managers,130,2026-07-18,35,0.0,1.351535475565576,0,
Show HN: IKEA Complexity Index,https://ikea.greg.technology/,DevOps,blog,developers,135,2026-07-18,4750,0.35,102.73391008702923,4,
I started a “dirt notebook”,https://pinewind.bearblog.dev/i-started-a-dirt-notebook/,Mobile,blog,developers,125,2026-07-18,3210,0.35,188.6474115024037,16,
Revisiting Yliluoma's ordered dither algorithm,https://30fps.net/pages/revisiting-yliluoma-2/,Backend,blog,developers,140,2026-07-13,626,0.25806451612903225,9.780064950601206,1,
Static search trees: 40x faster than binary search (2024),https://curiouscoding.nl/posts/static-search-tree/,Platform,blog,general_tech,180,2026-07-18,3221,0.07647058823529412,256.2983697441666,6,
Overtraining as the path to human-like AI,https://www.seangoedecke.com/overtraining-as-the-path-to-human-like-ai/,AI/ML,blog,developers,189,2026-07-18,111,0.0,2.8726114904307236,0,
Funny item co-occurrences in 3.2M Instacart orders,https://rogerdickey.com/funny-item-co-occurrences-in-3-million-instacart-orders/,Leadership,blog,managers,140,2026-07-15,1377,0.35,110.23024389507925,8,
Stenchill: 3D Printable Solder Paste Stencil Generator,https://www.stenchill.com/en/,DevOps,blog,developers,140,2026-07-18,2192,0.3108108108108108,54.610795976237256,17,
AI's new political donor class is outspending Big Tech's last one,https://sfstandard.com/2026/07/18/ai-s-new-political-donor-class-already-outspending-big-tech-s-last-one/,AI/ML,blog,developers,253,2026-07-18,220,0.0,17.46542079342453,0,
Roko's Dancing Basilisk,https://boston.conman.org/2025/12/02.1,Cloud,blog,developers,100,2026-07-16,126,0.35,16.32056413578327,0,
British runner Josh Kerr smashes 27-year-old men's mile record,https://www.espn.com/olympics/story/_/id/49391430/british-runner-josh-kerr-smashes-27-year-old-men-mile-record,Security,blog,developers,189,2026-07-18,51,0.0,5.7983044647277335,0,
Open Book Touch: open-source e-reader,https://www.crowdsupply.com/oddly-specific-objects/open-book-touch,Data Engineering,blog,developers,120,2026-07-18,4673,0.33116883116883117,149.32991762570163,33,
Traders are increasingly betting against SpaceX just weeks after IPO,https://www.ft.com/content/2b96703d-440b-46db-8d86-9fff9ecc59d5,AI/ML,blog,developers,210,2026-07-18,504,0.35,90.41195599440705,2,
Painting the sides of railroad rails white to reduce derailment,https://www.up.com/news/safety/Tracking-Rail-Heat-260608,AI/ML,blog,developers,210,2026-07-18,2296,0.35,119.7478567651682,14,
LG ThinQ Terms of Use,https://news.ycombinator.com/item?id=48958273,Frontend,blog,developers,115,2026-07-18,982,0.35,92.27896271416637,6,
An Update on Igalia's Layer Based SVG Engine in WebKit (Reducing Layer Overhead),https://blogs.igalia.com/nzimmermann/posts/2026-07-14-lbse-conditional-layers/,Frontend,blog,developers,299,2026-07-14,1314,0.07692307692307693,139.36566034346964,10,
Kimi K3: Open Frontier Intelligence,https://www.kimi.com/blog/kimi-k3,Mobile,blog,developers,105,2026-07-16,47957,0.35,2447.6858829570397,303,
Lego building instructions through time,https://www.lego.com/en-us/history/articles/d-lego-building-instructions-through-time,Frontend,blog,developers,100,2026-07-17,4614,0.25,79.53920658729035,23,
Topcoat: The full full-stack framework for Rust,https://github.com/tokio-rs/topcoat,Backend,case_study,developers,126,2026-07-18,2370,0.35,33.00324914663135,2,
Vāgdhenu: A Sanskrit Chanting TTS System,https://prathosh.in/vagdhenu/,Platform,blog,developers,138,2026-07-13,7735,0.24271844660194175,172.8465390526644,30,
"Battery packs: Let's talk about crates, baby",https://smallcultfollowing.com/babysteps/blog/2026/07/15/battery-packs/,Leadership,blog,managers,147,2026-07-17,957,0.35,52.37020218643841,4,
Show HN: A zoomable timeline of 4M Wikipedia events,https://app.everything.diena.co/,DevOps,blog,developers,171,2026-07-18,3742,0.35,285.6673459413797,23,
The state of open source AI,https://stateofopensource.ai/,AI/ML,blog,developers,168,2026-07-17,14302,0.35,1192.0946092052857,104,
Show HN: Watch bots interact with an SSH honeypot in real time,https://honeypotlive.cc/,Cloud,blog,developers,264,2026-07-17,5983,0.34502923976608185,257.87323218260786,25,
Three ways people respond to a problem (other than solving it),https://improvesomething.today/responses-to-problems/,Security,blog,developers,264,2026-07-17,7853,0.35,182.18545452124792,27,
Frank Lloyd Wright’s first home,https://www.architecturaldigest.com/story/frank-lloyd-wright-home-and-studio-everything-you-need-to-know,Data Engineering,blog,developers,135,2026-07-13,4164,0.35,302.6973137045684,18,
Steam Machine: Between 12k and 15k Units Sold per week,https://boilingsteam.com/steam-machine-between-10k-and-15k-sold-per-week/,Leadership,blog,managers,210,2026-07-18,2023,0.35,81.85140888825636,15,
Surrender as a non-stupid life strategy,https://sashachapin.substack.com/p/should-you-be-in-charge-of-your-life,Mobile,newsletter,developers,132,2026-07-18,156,0.3333333333333333,7.636489013579228,0,
Camera Chase Vehicle,https://transistor-man.com/gimbal_camera_rover.html,Platform,blog,executives,100,2026-07-10,5370,0.1,485.1601919345163,31,
More Bounce to the Ounce,https://mceglowski.substack.com/p/more-bounce-to-the-ounce,DevOps,newsletter,developers,120,2026-07-17,2427,0.35,212.2752850331755,8,
Why do AI company logos look like buttholes? (2025),https://velvetshark.com/ai-company-logos-that-look-like-buttholes,AI/ML,blog,developers,216,2026-07-18,9728,0.34805194805194806,1118.8695008558316,77,
How early SunOS did diskless workstations before NFS,https://utcc.utoronto.ca/~cks/space/blog/solaris/SunOSDisklessWithoutNFS,Cloud,blog,developers,168,2026-07-18,153,0.14285714285714285,12.229441053652968,0,
Engineering Peace,https://asteriskmag.com/issues/14/engineering-peace,Security,blog,developers,100,2026-07-11,306,0.35,30.53721535272834,0,
"Porting nanochat to a TPU: what carries over from PyTorch, and what breaks",https://github.com/tucan9389/nanochat-jax/discussions/1,Data Engineering,case_study,developers,364,2026-07-15,1096,0.17647058823529413,119.89581839222974,1,
Evidence of inconsistencies in evaluation process and selection of winners,https://www.kaggle.com/competitions/kaggle-measuring-agi/discussion/724918#3498423,Backend,blog,developers,210,2026-07-17,9075,0.35,951.8983668832599,71,
"Kaiser nurses say AI, surveillance are making their jobs and patient care worse",https://localnewsmatters.org/2026/07/15/kaiser-nurses-say-ai-workplace-surveillance-are-making-their-jobs-and-patient-care-worse/,AI/ML,blog,developers,286,2026-07-18,12895,0.35,1504.9031193612948,65,
Workspaces – Explore the workspaces of modern creators,https://workspaces.xyz/,Mobile,blog,developers,192,2026-07-17,2751,0.35,136.1849481547726,7,
Designing emoji for the way we communicate today,https://blog.google/products-and-platforms/platforms/android/world-emoji-day-noto-3d/,Platform,blog,developers,184,2026-07-17,1182,0.35,77.27371214661602,4,
AI Meets Cryptography 2: What AI Found in OpenVM's ZkVM,https://blog.zksecurity.xyz/posts/openvm-bugs/,AI/ML,blog,developers,240,2026-07-17,2216,0.08163265306122448,55.69936468284182,3,
Latent Space as a New Medium,https://kevinkelly.substack.com/p/latent-space-as-a-new-medium,Leadership,newsletter,managers,138,2026-07-13,3713,0.2962962962962963,258.3096364150118,23,
Lobste.rs is now running on SQLite,https://lobste.rs/s/ko1ji1,Data Engineering,blog,developers,126,2026-07-14,5036,0.35,287.3283701252088,7,
"FAA lets Boeing sign off on 737 MAX, 787 airworthiness certificates again",https://www.cnbc.com/2026/07/17/faa-boeing-737-max-787.html,AI/ML,blog,developers,288,2026-07-18,7096,0.35,67.48194988831192,10,
CD sales growth outpaced vinyl in the first half of 2026,https://consequence.net/2026/07/the-cd-revival-is-getting-hard-to-ignore/,DevOps,blog,developers,198,2026-07-16,3954,0.35,130.17440854282663,19,
MoonBASIC: A modern BASIC for building 2D and 3D games,https://github.com/CharmingBlaze/moonbasic,Frontend,case_study,executives,280,2026-07-14,1075,0.35,116.83379349650708,8,
GitRoot,https://gitroot.dev/,Cloud,blog,developers,100,2026-07-18,174,0.2,8.25521027291247,0,
The LLM Critics Are Right. I Use LLMs Anyway,https://www.theocharis.dev/blog/llm-critics-are-right-i-use-llms-anyway/,AI/ML,blog,developers,234,2026-07-16,6305,0.35,476.6997896256785,19,
"Moonstone: Modern, cross-platform Lua runtime and package manager written in Zig",https://moonstone.sh/,Platform,blog,developers,242,2026-07-18,955,0.27419354838709675,152.20808456425777,2,
Apple targets dozens of OpenAI employees with legal letters,https://www.ft.com/content/1b8c9d52-88a9-426b-ba47-f1811f859166,AI/ML,blog,developers,189,2026-07-17,9969,0.35,580.5042596900624,15,
Faster binary search: from compiled code to mechanical sympathy,https://pythonspeed.com/articles/branchless-binary-search/,Security,blog,developers,225,2026-07-12,2153,0.21428571428571427,32.804458175330545,15,
Three workers digging in a field outside the data center,https://sign2.nl/websign/three-workers-digging-in-a-field-outside-the-data-center-by-dinnis-van-dijken/,Data Engineering,blog,developers,220,2026-07-18,204,0.2222222222222222,11.221487777377957,0,
"How Has Roman Concrete Lasted for Millennia? 1,900-Year-Old Latrine Offers Clues",https://www.smithsonianmag.com/smart-news/how-has-roman-concrete-lasted-for-millennia-a-1900-year-old-latrine-offers-new-clues-about-the-materials-impressive-durability-180989115/,Backend,blog,developers,297,2026-07-17,7828,0.35,322.48013267788644,47,
Microsoft Comic Chat is now open source,https://opensource.microsoft.com/blog/2026/07/16/microsoft-comic-chat-is-now-open-source/,Mobile,blog,developers,161,2026-07-16,14050,0.2202753441802253,1620.7490249806579,35,
The Isomorphic Labs Drug Design Engine unlocks a new frontier beyond AlphaFold,https://www.isomorphiclabs.com/articles/the-isomorphic-labs-drug-design-engine-unlocks-a-new-frontier,Leadership,blog,managers,312,2026-07-18,2538,0.1,239.50334489566154,3,
VulnHunter: Capital One's agentic AI code security tool,https://www.capitalone.com/tech/open-source/announcing-vulnhunter/,AI/ML,blog,developers,216,2026-07-17,2823,0.35,65.1532551785878,13,
How to Train a Gen AI Kick Drum Model on Your Old Linux Desktop with 6GB VRAM,https://www.zhinit.dev/blog/training-a-kick-drum-diffusion-model,AI/ML,blog,developers,374,2026-07-16,3434,0.35,98.16828664970305,6,
Helium escaping from atmosphere of nearby rocky exoplanet in a habitable zone,https://www.science.org/doi/10.1126/science.aea9708,Backend,blog,general_tech,276,2026-07-17,5535,0.35,331.45250271723177,37,
Mac gaming is finally getting the overpowered upgrade it deserves,https://www.macworld.com/article/3189951/apples-latest-game-porting-toolkit-beta-changed-how-i-think-about-mac-gaming.html,DevOps,blog,developers,260,2026-07-18,2312,0.35,53.314562210611,3,
Homomorphically encrypted CIFAR-10 inference in 200ms,https://sofar.belfortlabs.cloud/,Security,blog,developers,144,2026-07-17,3269,0.35,227.86525148458256,15,
Decoy Font,https://www.mixfont.com/experiments/decoy-font,Cloud,blog,developers,100,2026-07-16,27980,0.2237960339943343,1189.7867495364635,103,
Mathematics of Data Science,https://arxiv.org/abs/2607.11938,Data Engineering,whitepaper,executives,100,2026-07-17,5935,0.0660377358490566,343.46724892329576,45,
Ente – Opening Our Books,https://ente.com/open/,Frontend,blog,developers,125,2026-07-16,5791,0.35,626.0826638749288,28,
The lost joy of music piracy,https://www.pigeonsandplanes.com/read/music-piracy-what-cd-oink-nine-inch-nails-streaming,Mobile,blog,developers,108,2026-07-16,14538,0.35,2124.302968660623,114,
Goes-19 weather satellite enters Safe Hold mode,https://www.spaceweather.gov/news/goes-19-safe-hold,Backend,blog,developers,189,2026-07-16,3536,0.35,503.17454046588176,22,
Claude Code(Fable) refused my slow down instruction,https://qusaisuwan.github.io/cc-incident/index.html,Platform,blog,developers,133,2026-07-18,451,0.35,31.94963586816763,0,
Pebble Mega Update – July 2026,https://repebble.com/blog/pebble-mega-update-july-2026,Leadership,blog,managers,114,2026-07-17,6829,0.35,641.7523566974303,41,
Estimating the heights of New Yorkers from their scuff marks,https://blog.jse.li/posts/smith9street/,DevOps,blog,developers,220,2026-07-14,1274,0.3,12.77805498136009,5,
ASCII Art,https://github.com/doctorfree/Asciiville,Cloud,case_study,developers,100,2026-07-18,410,0.0,25.99444773441941,2,
British Steel taken into public ownership to protect 'vital' UK supply,https://www.bbc.com/news/articles/c5y680w62wno,Security,blog,developers,264,2026-07-16,5695,0.35,429.57738666893226,29,
Quintile – keyboard N×M grid tiling for macOS,https://github.com/stefanopineda/quintile,Frontend,case_study,developers,152,2026-07-13,336,0.3,24.5793530385045,1,
Starlink from 1984,https://nemanjatrifunovic.substack.com/p/starlink-from-1984,Mobile,newsletter,developers,100,2026-07-12,1235,0.35,109.10576929812392,2,
Inkling: Our Open-Weights Model,https://thinkingmachines.ai/news/introducing-inkling/,Platform,blog,developers,100,2026-07-15,20762,0.24092409240924093,1778.6170177928143,66,
Frame – Linux X server in Assembly,https://isene.org/2026/07/Frame.html,Leadership,blog,managers,147,2026-07-17,5815,0.35,109.35727384201623,17,
'Likweli': A new monkey species discovered in the Congo Basin,https://news.yale.edu/2026/07/15/meet-likweli-new-monkey-species-discovered-congo-basin,Backend,blog,developers,240,2026-07-17,1907,0.2627118644067797,171.3045925036363,6,
Turn your singing voice into printable notes (in the browser),https://om-intelligence.ch/projects/vocal-notation/vocal-notation.html,DevOps,blog,developers,190,2026-07-14,3189,0.2857142857142857,194.28314372303657,9,
The case for eating more organ meat,https://www.nationalgeographic.com/health/article/offal-organ-meat-nutrition-health,Cloud,blog,developers,133,2026-07-18,252,0.35,17.067931492521634,0,
"Aurora DSQL: Scalable, Multi-Region OLTP",https://arxiv.org/abs/2607.13276,Data Engineering,whitepaper,developers,105,2026-07-18,655,0.09523809523809523,23.176383097351327,1,
Teardown: A Generic 7-Port USB 3.0 Hub That Wasn't,https://goughlui.com/2026/07/09/teardown-a-generic-7-port-usb-3-0-hub-that-wasnt/,Security,blog,developers,198,2026-07-12,5657,0.35,199.2785415636149,21,
Sony deletes more movies from the accounts of people who ‘bought’ them,https://www.techdirt.com/2026/07/15/sony-deletes-a-bunch-more-movies-from-the-accounts-of-people-who-bought-them/,Frontend,blog,executives,228,2026-07-16,27262,0.35,1694.1272896735315,94,
A Road to Lisp: Which Lisp,https://scotto.me/blog/2026-07-17-which-lisp/,Mobile,blog,developers,126,2026-07-17,4750,0.35,244.83846661241384,16,
Show HN: Clx – Compile Lua to Native Executables Through C++20,https://github.com/samyeyo/clx,Platform,case_study,developers,209,2026-07-11,2138,0.22535211267605634,129.59448357352596,3,
EEG shows brain can simultaneous encode two speech streams,https://journals.plos.org/plosbiology/article?id=10.1371/journal.pbio.3003876,AI/ML,blog,developers,225,2026-07-17,5578,0.35,181.54117876103248,35,
"If you want to create a button from scratch, you must first create the universe",https://madcampos.dev/blog/2026/07/accessibility-from-scratch/,Leadership,blog,managers,360,2026-07-16,7181,0.35,402.25037347246587,36,
$100 AI Music Video: Claude Fable 5 vs. GPT-5.6 Sol,https://www.tryai.dev/blog/ai-music-video-arena-claude-vs-gpt-5.6,AI/ML,video,developers,240,2026-07-17,8772,0.35,1121.5688951884522,34,
OnePlus halts operations in USA and Europe,https://community.oneplus.com/thread/2170715118587871237,DevOps,blog,developers,182,2026-07-16,15886,0.35,591.0789780098246,96,
Pseudpocalypse,https://dynomight.net/pseudpocalypse/,Cloud,blog,developers,100,2026-07-14,3781,0.35,183.90756429104135,17,
NotebookLM is now Gemini Notebook,https://blog.google/innovation-and-ai/products/gemini-notebook/notebooklm-gemini-notebook/,AI/ML,blog,developers,130,2026-07-16,13521,0.35,1087.8077894129003,102,
AI Mania Is Eviscerating Global Decision-Making,https://ludic.mataroa.blog/blog/ai-mania-is-eviscerating-global-decision-making/,AI/ML,blog,developers,126,2026-07-18,528,0.14705882352941177,79.82332624879652,1,
Tannakian Reconstruction,https://bartoszmilewski.com/2026/07/14/tannakian-reconstruction/,Security,blog,developers,100,2026-07-14,995,0.09375,26.947404637942,1,
Why is tiny Norway so good at sports? It's more than Erling Haaland,https://www.csmonitor.com/World/Europe/2026/0710/norway-erling-haaland-soccer-youth-sports-competition-training,Backend,blog,developers,338,2026-07-18,238,0.35,26.514771980423284,1,
Bluesky Trademarks ATProto,https://atproto.com/blog/at-protocol-trademark,Data Engineering,blog,developers,100,2026-07-16,7668,0.35,547.5254318814884,40,
Schema Harness Achieves ~99% on Arc‑AGI‑3 Public,https://schema-harness.github.io/,Frontend,blog,developers,126,2026-07-16,4451,0.35,366.8532921826051,21,
LM Studio Bionic: the AI agent for open models,https://lmstudio.ai/blog/introducing-lm-studio-bionic,AI/ML,blog,developers,216,2026-07-17,11459,0.35,777.9713499438099,72,
Shipping OpenStrike: A Counter-Strike-Shaped FPS on a 2004 Handheld,https://pocketjs.dev/blog/shipping-openstrike/,Mobile,blog,general_tech,180,2026-07-11,783,0.3125,27.40706506548927,1,
How to Write Unmaintainable Code (2015),https://github.com/droogans/unmaintainable-code,AI/ML,case_study,developers,156,2026-07-18,800,0.06896551724137931,13.630358142065319,1,
Alzheimer's trial results lend momentum to strategies targeting tau,https://www.science.org/content/article/alzheimer-s-trial-results-lend-momentum-strategies-targeting-tau,Platform,blog,developers,207,2026-07-17,613,0.2,21.47330489637825,2,
Show HN: Instrumation a PYPI library for Instruments,https://github.com/abduznik/instrumation,Leadership,case_study,managers,224,2026-07-12,338,0.1,18.43204488574618,2,
How Our Rust-to-Zig Rewrite Is Going,https://rtfeldman.com/rust-to-zig,Backend,blog,developers,162,2026-07-16,16082,0.35,540.9478594651803,68,
Let's Build PlanetScale from Scratch: Infrastructure,https://onatm.dev/2026/07/16/homescale-part-1/,Frontend,blog,developers,138,2026-07-16,4186,0.14084507042253522,341.85954013389295,28,
"Faulty Towers, vibe sickness, and the vibe bobsled",https://dustycloud.org/blog/faulty-towers-vibe-sickness-and-the-vibe-bobsled/,DevOps,blog,general_tech,152,2026-07-18,453,0.35,8.162908679095287,1,
An Engineer's Guide to USB Typе-С (2024),https://www.ti.com/lit/eb/slyy228/slyy228.pdf?ts=1759892558029,Frontend,blog,developers,168,2026-07-10,7284,0.26804123711340205,192.80787615075795,54,
The Largest Vocabulary in Hip Hop (2017),https://pudding.cool/2017/02/vocabulary/index.html,Cloud,blog,developers,126,2026-07-18,305,0.16666666666666666,20.46496226358554,1,
